[
  {
    "id": "map:forest",
    "locationId": "location:forest",
    "image": "assets/maps/forest.webp",
    "width": 1363,
    "height": 712,
    "sourceWidth": 2492,
    "sourceHeight": 1300,
    "sourceUrl": "https://api.miscritcompanion.com/api/maps/forest.jpg",
    "captureMethod": "browser-render-capture-cropped-to-image-bounds",
    "quality": "preview-raster-not-original-download",
    "coordinateSystem": "normalized-0-1-top-left",
    "provenance": {
      "sourceId": "companion-map",
      "retrievedOn": "2026-09-15",
      "method": "rendered-raster",
      "gameVerified": false
    }
  },
  {
    "id": "map:hidden-forest",
    "locationId": "location:hidden-forest",
    "image": "assets/maps/hidden-forest.webp",
    "width": 1363,
    "height": 708,
    "sourceWidth": 2524,
    "sourceHeight": 1311,
    "sourceUrl": "https://api.miscritcompanion.com/api/maps/hidden_forest.jpg",
    "captureMethod": "browser-render-capture-cropped-to-image-bounds",
    "quality": "preview-raster-not-original-download",
    "coordinateSystem": "normalized-0-1-top-left",
    "provenance": {
      "sourceId": "companion-map",
      "retrievedOn": "2026-09-15",
      "method": "rendered-raster",
      "gameVerified": false
    }
  },
  {
    "id": "map:mansion",
    "locationId": "location:mansion",
    "image": "assets/maps/mansion.webp",
    "width": 661,
    "height": 936,
    "sourceWidth": 3250,
    "sourceHeight": 4600,
    "sourceUrl": "https://api.miscritcompanion.com/api/maps/mansion_all.png",
    "captureMethod": "browser-render-capture-cropped-to-image-bounds",
    "quality": "preview-raster-not-original-download",
    "coordinateSystem": "normalized-0-1-top-left",
    "provenance": {
      "sourceId": "companion-map",
      "retrievedOn": "2026-09-15",
      "method": "rendered-raster",
      "gameVerified": false
    }
  },
  {
    "id": "map:mount-gemma",
    "locationId": "location:mount-gemma",
    "image": "assets/maps/mount-gemma.webp",
    "width": 1363,
    "height": 836,
    "sourceWidth": 2073,
    "sourceHeight": 1273,
    "sourceUrl": "https://api.miscritcompanion.com/api/maps/mount_gemma.png",
    "captureMethod": "browser-render-capture-cropped-to-image-bounds",
    "quality": "preview-raster-not-original-download",
    "coordinateSystem": "normalized-0-1-top-left",
    "provenance": {
      "sourceId": "companion-map",
      "retrievedOn": "2026-09-15",
      "method": "rendered-raster",
      "gameVerified": false
    }
  },
  {
    "id": "map:cave",
    "locationId": "location:cave",
    "image": "assets/maps/cave.webp",
    "width": 1097,
    "height": 936,
    "sourceWidth": 1270,
    "sourceHeight": 1083,
    "sourceUrl": "https://api.miscritcompanion.com/api/maps/cave.png",
    "captureMethod": "browser-render-capture-cropped-to-image-bounds",
    "quality": "preview-raster-not-original-download",
    "coordinateSystem": "normalized-0-1-top-left",
    "provenance": {
      "sourceId": "companion-map",
      "retrievedOn": "2026-09-15",
      "method": "rendered-raster",
      "gameVerified": false
    }
  },
  {
    "id": "map:shack",
    "locationId": "location:shack",
    "image": "assets/maps/shack.webp",
    "width": 1013,
    "height": 936,
    "sourceWidth": 2962,
    "sourceHeight": 2735,
    "sourceUrl": "https://api.miscritcompanion.com/api/maps/shack_all.jpg",
    "captureMethod": "browser-render-capture-cropped-to-image-bounds",
    "quality": "preview-raster-not-original-download",
    "coordinateSystem": "normalized-0-1-top-left",
    "provenance": {
      "sourceId": "companion-map",
      "retrievedOn": "2026-09-15",
      "method": "rendered-raster",
      "gameVerified": false
    }
  },
  {
    "id": "map:sunfall-shores",
    "locationId": "location:sunfall-shores",
    "image": "assets/maps/sunfall-shores.webp",
    "width": 1363,
    "height": 682,
    "sourceWidth": 2194,
    "sourceHeight": 1099,
    "sourceUrl": "https://api.miscritcompanion.com/api/maps/sunfall_shores.jpg",
    "captureMethod": "browser-render-capture-cropped-to-image-bounds",
    "quality": "preview-raster-not-original-download",
    "coordinateSystem": "normalized-0-1-top-left",
    "provenance": {
      "sourceId": "companion-map",
      "retrievedOn": "2026-09-15",
      "method": "rendered-raster",
      "gameVerified": false
    }
  },
  {
    "id": "map:miscrian-jungle",
    "locationId": "location:miscrian-jungle",
    "image": "assets/maps/miscrian-jungle.webp",
    "width": 1363,
    "height": 664,
    "sourceWidth": 3000,
    "sourceHeight": 1460,
    "sourceUrl": "https://api.miscritcompanion.com/api/maps/jungle.webp",
    "captureMethod": "browser-render-capture-cropped-to-image-bounds",
    "quality": "preview-raster-not-original-download",
    "coordinateSystem": "normalized-0-1-top-left",
    "provenance": {
      "sourceId": "companion-map",
      "retrievedOn": "2026-09-15",
      "method": "rendered-raster",
      "gameVerified": false
    }
  },
  {
    "id": "map:moon",
    "locationId": "location:moon",
    "image": "assets/maps/moon.webp",
    "width": 730,
    "height": 936,
    "sourceWidth": 2522,
    "sourceHeight": 3230,
    "sourceUrl": "https://api.miscritcompanion.com/api/maps/moon.png",
    "captureMethod": "browser-render-capture-cropped-to-image-bounds",
    "quality": "preview-raster-not-original-download",
    "coordinateSystem": "normalized-0-1-top-left",
    "provenance": {
      "sourceId": "companion-map",
      "retrievedOn": "2026-09-15",
      "method": "rendered-raster",
      "gameVerified": false
    }
  },
  {
    "id": "map:emerald-isle",
    "locationId": "location:emerald-isle",
    "image": "assets/maps/emerald-isle.webp",
    "width": 1127,
    "height": 936,
    "sourceWidth": 3000,
    "sourceHeight": 2490,
    "sourceUrl": "https://api.miscritcompanion.com/api/maps/emerald_isle.webp",
    "captureMethod": "browser-render-capture-cropped-to-image-bounds",
    "quality": "preview-raster-not-original-download",
    "coordinateSystem": "normalized-0-1-top-left",
    "provenance": {
      "sourceId": "companion-map",
      "retrievedOn": "2026-09-15",
      "method": "rendered-raster",
      "gameVerified": false
    }
  },
  {
    "id": "map:temple",
    "locationId": "location:temple",
    "image": "assets/maps/temple.webp",
    "width": 1363,
    "height": 860,
    "sourceWidth": 3000,
    "sourceHeight": 1893,
    "sourceUrl": "https://api.miscritcompanion.com/api/maps/temple.webp",
    "captureMethod": "browser-render-capture-cropped-to-image-bounds",
    "quality": "preview-raster-not-original-download",
    "coordinateSystem": "normalized-0-1-top-left",
    "provenance": {
      "sourceId": "companion-map",
      "retrievedOn": "2026-09-15",
      "method": "rendered-raster",
      "gameVerified": false
    }
  },
  {
    "id": "map:monks-mountain",
    "locationId": "location:monks-mountain",
    "image": "assets/maps/monks-mountain.webp",
    "width": 608,
    "height": 936,
    "sourceWidth": 1949,
    "sourceHeight": 3000,
    "sourceUrl": "https://api.miscritcompanion.com/api/maps/monks_mountain.webp",
    "captureMethod": "browser-render-capture-cropped-to-image-bounds",
    "quality": "preview-raster-not-original-download",
    "coordinateSystem": "normalized-0-1-top-left",
    "provenance": {
      "sourceId": "companion-map",
      "retrievedOn": "2026-09-15",
      "method": "rendered-raster",
      "gameVerified": false
    }
  }
]
